Conversation_Name,Category,Summary,User_Behavior,Company_Performance,Next_Best_Action
alfonzoreyes_099871591851,Dropped Follow-Up,"Alfonzo Reyes reached out to Spectroplus for a custom 160 sqm 2-storey modern industrial residential project in Dasmariñas, Cavite. While the initial engagement was promising with quick responses from the company, the process stalled after Spectroplus failed to deliver a promised estimate by the following Wednesday. Consequently, the client grew frustrated by the lack of communication and officially ended the inquiry to seek other providers.",The client was a high-intent lead who provided detailed project specifications and clear preferences immediately. They demonstrated professional courtesy by waiting past the deadline before following up and eventually terminating the lead once their expectations for responsiveness were not met.,"Spectroplus exhibited poor follow-through. Despite a strong initial response time, the company failed to meet its own deadline and subsequently ghosted the client for two weeks, directly resulting in the loss of a qualified, high-value project.","Since the client has already expressed intent to look elsewhere, an immediate, humble apology acknowledging the failure to meet the deadline is required. While the lead is effectively lost, the company should conduct an internal audit of their quoting process to ensure estimator delays are communicated to the client before the deadline passes in future interactions."
alvinpanganiban_37586123512125,Active Pipeline,"Dr. Alvin Panganiban is seeking a design and build team for a 65 sqm dental clinic renovation in Alabang, specifically requesting technical expertise in dental chair plumbing and X-ray room shielding. Spectroplus responded promptly, confirming their specialization and providing a formal proposal and contract. The company has followed up on the proposal, but the client has not yet responded to the milestone structure and mobilization terms.",High-intent client with a clear project scope and specific technical requirements; communication is professional and deadline-oriented.,"Excellent initial engagement; the company demonstrated technical competence, provided necessary documentation, and performed timely follow-ups.","Since the client hasn't replied to the follow-up, send a low-pressure message asking if he would like to schedule a site visit or a brief call to discuss the milestone payment structure in person."
arnelbautista_47615129419208451,Active Pipeline,"Arnel Bautista is inquiring about constructing a 2-storey, 3-bedroom modern residential house in Golden Horizon Subdivision, General Trias, Cavite. The client has already provided complete project details and a preliminary sketch based on his lot title. Spectroplus responded promptly, confirming the project scope and scheduling a follow-up call with an engineer for the following morning.","High-intent lead who is organized, clear about requirements, and ready to move to the consultation phase.",Excellent initial response time; the company demonstrated professionalism by validating the project scope and setting a clear expectation for the next step.,Ensure the engineer calls the client at the agreed-upon time and is prepared with a basic design consultation script and information on the site survey process.
biancatorres_5916561512,Dropped Follow-Up,"Bianca Torres reached out for a commercial spa and wellness clinic fit-out in Imus, Cavite, leading to a successful initial site inspection on August 13th. The company promised deliverables within 5 working days, but failed to provide the 3D design concept and pricing draft. The client has since sent two follow-up messages expressing frustration due to mounting pressure from her building manager.","The client is highly motivated, professional, and time-sensitive, as evidenced by her clear project requirements and the urgency caused by mall developer deadlines.","The company initially performed well with rapid lead qualification and site visit scheduling but failed significantly by missing the 5-day commitment and ghosting the client, jeopardizing a high-value commercial project.","The company must immediately apologize for the delay, provide a concrete timeline for the delivery of the designs today, and offer a gesture of goodwill (such as a discount or expedited project timeline) to rebuild trust."
christianpineda_6125619825125,Active Pipeline,"Engr. Christian Pineda reached out regarding a construction partnership for a 2-storey modern duplex residential project in Meadowood Executive Village, Bacoor, Cavite. He has already prepared basic structural drafting concepts and is specifically seeking a partner for the execution phase. The company responded quickly to acknowledge the project and requested a discovery call, leaving the interaction at the scheduling stage.","The client is a professional (Engineer) with a high level of preparedness and clear project specifications, indicating high intent and a streamlined decision-making process.","The company demonstrated excellent response time and professionalism, immediately pivoting to a discovery call to convert the lead into a live consultation.",Follow up with a calendar link or three specific time slots for the discovery call to minimize friction and secure the meeting before the client explores other contractors.
clarisseramos_76712412412412,Closed-Lost,Clarisse Ramos requested a commercial fit-out quote for a 45 sqm coffee shop in Parañaque City. Spectroplus provided a prompt 3D concept layout and material specifications. The client ultimately decided to pause the project indefinitely due to internal partnership budget issues.,"The client was highly engaged, professional, and clear about her requirements, but she demonstrated a clear pivot once internal financial obstacles arose.",Spectroplus performed exceptionally well with very fast response times and high-quality deliverables that clearly met the client's design expectations.,Mark this lead as 'Paused/Future Opportunity' in the CRM and schedule an automated follow-up check-in for 90 days from now to see if their budget situation has stabilized.
davealcantara_971624151251,Active Pipeline,"Dave Alcantara is inquiring about the construction of a 4m x 8m custom concrete infinity pool with composite wood decking in Antipolo City. The project site features a sloped backyard, raising concerns about structural safety and drainage, which the company has addressed by recommending a concrete pile foundation and retaining walls. The company has provided a rough cost estimate and is currently pushing for a site visit with their structural engineer.","The client is highly informed and cautious, focusing on technical longevity and soil stability rather than just aesthetics or price. His detailed initial inquiry indicates high intent and readiness to proceed if safety concerns are addressed.","The company has demonstrated excellent responsiveness, with quick initial replies and clear, value-add technical advice. They proactively initiated a follow-up to secure a site visit, maintaining momentum in the sales cycle.","If the client does not respond to the Wednesday slot, offer alternative times for the ocular visit or provide a case study of a similar sloped project they have completed to build further trust. The focus must remain on overcoming the client's structural anxiety to secure the site visit."
dianarosecruz_687512869586151,Unanswered Inbound,"The client is inquiring about structural design and construction management services for a 3-storey modern townhouse project located in Quezon City. She is specifically asking if the company's service package includes building permit processing, demolition management, and structural layouts for her approximately 220 sqm project. The inquiry is detailed and provides specific contact information and property specifications, indicating a high level of project readiness.","The client is highly motivated, professional, and has provided all necessary information upfront, suggesting a serious intent to proceed with a qualified contractor.","The company has failed to acknowledge or respond to the inquiry since it was sent, resulting in a missed opportunity to engage a high-value lead.","Immediately contact the client via the provided mobile number or chat to acknowledge the inquiry, confirm capabilities regarding permit processing and demolition, and schedule an initial site consultation."
elenatorres_325416161161,Closed-Lost,"Elena Torres from Nexus Logistics Corp requested a site inspection for a 400 sqm warehouse roofing and structural truss project in North Harbor, Manila. Spectroplus responded promptly and provided a formal proposal, but the client ultimately declined the offer. The lead chose an in-house local contractor due to pricing constraints, despite expressing appreciation for the professionalism and detail provided by Spectroplus.","The client displayed high intent and professional communication, clearly defined their project scope, and provided an honest, constructive reason for rejection (price sensitivity).","Spectroplus demonstrated excellent responsiveness, professional follow-up, and a graceful exit, maintaining a positive relationship even after the loss.","Tag this contact as a long-term prospect and initiate a quarterly check-in sequence to monitor the performance of the chosen local contractor, as the client may return if quality issues arise with the cheaper alternative."
gilbertsantos_13756912562,Active Pipeline,"Gilbert Santos is requesting adjustments to the Bill of Quantities (BOQ) to bring his construction project within his budget ceiling. Spectroplus successfully proposed value engineering options, specifically switching to SPC vinyl and granite to reduce costs by 185,000 PHP. The client has accepted these changes and is now waiting for the updated proposal to proceed with signing the contract and submitting the down payment.",Highly engaged and decisive; the client clearly understands his budget constraints and is ready to convert once the documentation reflects the agreed-upon changes.,"Excellent responsiveness and technical competency; the company quickly provided a viable solution to the budget objection, effectively moving the lead toward conversion.",Immediately send the updated structural layout and BOQ for his signature to facilitate the mobilization down payment and secure the project start date.
gracemendoza_75185149164412,New & Out-of-Scope,"The client inquired about the company's capability to build a single-detached concrete house in Vigan City, Ilocos Sur. The company responded promptly to identify the location of the project. After determining the site is outside their operational coverage area of Metro Manila and CALABARZON, the company politely declined the project.","The client is a direct lead looking for construction services with clear project parameters and location details, demonstrating a high degree of intent but ultimately mismatched geography.","The company performance was excellent, demonstrating a fast response time and providing a clear, transparent explanation for why they could not accept the project, thus maintaining professional standards.","No further action is required as the inquiry is out-of-scope; the file should be archived as a closed, non-conversion lead due to geographical limitations."
jasminecruz_17981761236,Active Pipeline,"Jasmine Cruz is coordinating a structural site inspection with the Spectroplus engineering team for her project. The client has provided a map pin for her location and cleared the engineering team's entry with her subdivision's security office. The inspection is scheduled for this Sunday at 9:30 AM, with clear protocols for arrival and access established.","The client is proactive, highly cooperative, and clearly motivated to move the project forward, as evidenced by her efforts to ensure seamless site access.",Spectroplus is maintaining excellent professional standards with timely confirmations and clear communication regarding their arrival and logistical requirements.,"Ensure the site inspection team is fully briefed on the security protocols, maintains the requested contact schedule upon approaching the highway, and delivers a professional, punctual arrival to maintain client trust."
jaspercruz_616412512515125,Closed-Lost,"Jasper Cruz inquired about a second-floor home extension in Pasig City, specifically requesting custom plans and a BOQ for bank financing. Spectroplus responded promptly, conducted a structural assessment, and provided the necessary documentation within 24 hours. The client has requested to put the project on hold due to unforeseen compliance issues regarding his bank loan application.",High-intent lead who provided all necessary documentation and project specifics upfront; communication was professional and transparent regarding their financial constraints.,"Excellent; the company was responsive, provided high-value technical deliverables quickly, and followed up proactively to ensure the client had everything needed for the bank.","Mark as a 'nurture' lead in the CRM. Set a follow-up reminder for 30-45 days to check in on the status of their bank loan compliance without being pushy, as the technical work is already prepared for when they are ready to proceed."
jonathanreyes_82638541269512,Active Pipeline,"Jonathan Reyes inquired about a 180 sqm 2-storey modern farmhouse in Amadeo, Cavite, with a preference for standard finishes. Spectroplus provided a prompt quote and a preliminary conceptual floor plan. The company has followed up regarding the layout, and the conversation is currently awaiting further feedback from the client.","The client shows high intent and clear project specifications, demonstrating a collaborative approach and willingness to review design drafts.",Excellent responsiveness and proactive communication; the team provided both budget ranges and design conceptualization within 48 hours.,"Since the client hasn't replied to the layout follow-up, suggest a low-pressure phone call or a virtual meeting to discuss the floor plan's specific features, which often helps move a client from 'viewing drafts' to 'contracting'."
juandelacruz_7519512512512,Active Pipeline,The client is inquiring about pricing for a simple two-story residential build. The company responded promptly with qualifying questions regarding lot location and floor area to provide a more accurate estimate. The conversation is currently pending the client's response to these qualifying questions.,"The client is in the exploratory phase, showing interest but keeping communication vague by prioritizing general price inquiry over project specifics.",The company demonstrated high responsiveness and effectively managed the inquiry by steering the client toward providing technical project requirements.,"Wait for the client's response. If no follow-up occurs within 48 hours, send a gentle nudge requesting the lot location or floor area estimate to continue the design consultation."
kevinsantos_513129571205125,New & Out-of-Scope,"The client, Kevin Santos, reached out seeking repair services for damaged kitchen cabinet doors and hinges at his Alabang residence following flood damage. Spectroplus responded by clarifying their service scope and identifying that the request is for minor carpentry work. The company subsequently declined the project, noting that they only handle major structural, commercial, or full interior renovation projects.","The client is a direct, task-oriented lead looking for a specific, minor repair. He provided clear context regarding the nature of the damage and location, indicating moderate urgency.","The company performed effectively by quickly qualifying the lead, managing expectations, and politely declining the request to focus on their core business model, avoiding time-wasting site visits.","No further action is required, as the client's request falls strictly outside the company's service offerings. To provide good customer service, the company could optionally provide a referral to a trusted local handyman or small-scale carpenter if they have a professional network."
kevin_mercado_4561457164871,Unanswered Inbound,"Kevin Mercado, Operations Head of Mode Fashion Group, reached out regarding a 55 sqm commercial interior fit-out project at Bonifacio High Street in Taguig. He provided specific technical requirements and requested an ocular site visit for Monday morning to align with urgent mall turnover deadlines. The company has failed to respond to his initial inquiry and subsequent follow-up, leaving the lead unaddressed.","The client is highly professional, prepared, and under significant time pressure due to strict mall turnover constraints. He provided comprehensive project details immediately, signaling high purchase intent and urgency.","The company has performed poorly by failing to acknowledge or respond to an urgent, high-value commercial lead for over 24 hours. This lack of responsiveness risks losing the opportunity entirely due to the client's time-sensitive requirements.",Immediate contact is required to apologize for the delay. The company must confirm availability for the requested Monday ocular visit or explain scheduling constraints to maintain professional credibility and attempt to save the lead.
lestersantos_6158912591251,Dropped Follow-Up,"Engr. Lester Santos approached Spectroplus for an industrial mezzanine extension project in Biñan, Laguna, providing detailed structural specifications. The parties reached a preliminary agreement on contract terms, but the client requested a minor payment milestone adjustment. Despite Spectroplus promising a revised contract within a day, they failed to follow up for over a week, leading the client to cancel and sign with a competitor.","The client was highly professional, transparent, and ready to mobilize, exhibiting high intent and clear project urgency as an engineering lead.","Spectroplus exhibited a severe breakdown in communication by failing to deliver a promised document, effectively abandoning a confirmed, high-value industrial lead.","Contact the client immediately to apologize for the oversight, acknowledge the error, and ask for feedback on where the process failed to improve future internal lead management workflows."
mariaelenasantos_98978237986517986,Unanswered Inbound,"Maria Elena Santos reached out to inquire about a custom house construction package for a 90 sqm modern minimalist bungalow in Imus, Cavite. The project is intended for her parents and includes specific requirements for a senior-friendly layout. The client provided her contact details and is currently awaiting a budget estimate and an overview of the blueprint processing timeline.","High-intent lead; the client provided detailed project specifications, location, and direct contact information, indicating readiness to move forward if the pricing meets her expectations.","The company has failed to acknowledge or respond to the initial inquiry, representing a significant missed opportunity for a qualified lead.","Contact the client immediately via phone or SMS using the provided number to acknowledge receipt of the inquiry, apologize for the delay, and schedule an initial consultation to discuss the blueprint process and preliminary budget."
maritesdizon_6852735319751,Active Pipeline,"The client, Marites Dizon, is seeking to construct an 8-unit studio apartment complex in Las Piñas City and has a lot ready for immediate development. The company responded promptly, scheduled a site inspection, and dispatched an engineering team to the location. The conversation is currently active, with the company confirming the team's arrival for the scheduled Friday site visit.","The client shows high intent and readiness, providing specific details, contact information, and being proactive in coordinating with her property caretaker.","The company has performed excellently, demonstrating a rapid response time, clear communication, and a professional process by sending a specialized team to the site.","Ensure the team documents the site visit thoroughly, provides a preliminary assessment or project estimate within 48 hours of the visit, and outlines the next steps for architectural planning."
markmendoza_12412412412,Active Pipeline,"Mark Mendoza reached out for a design and build package for a 150 sqm 2-storey modern minimalist house in Bacoor, Cavite. Spectroplus responded promptly, providing a rough cost estimate of 3.5M to 4M PHP. The client is currently reviewing the proposal with his spouse, and Spectroplus has proactively reached out to offer a site visit for this upcoming weekend.","The client is highly qualified, providing complete project details upfront, and is currently in the decision-making phase with a secondary stakeholder.",Excellent responsiveness and professionalism; the company provided a quick estimate and a clear call-to-action to move the lead to a site visit.,"Wait for the client's response to the site visit offer; if no response is received by early next week, follow up with a soft touchpoint focusing on the value of a site assessment versus the rough estimate."
michellelim_512851251251,Active Pipeline,"Michelle Lim from InnoTech Solutions is requesting an inspection and layout quotation for a 120 sqm commercial office fit-out in Alabang. The project requires drywalls, glass partitions, and network cabling with a tight 2-month mobilization timeline. Spectroplus has confirmed their interest and scheduled a site ocular for the upcoming Tuesday.","High-intent professional lead; provides clear project specifications, site details, and timeline requirements, indicating a high level of readiness to proceed.","Excellent initial response time of 12 minutes; tone is professional and reassuring, demonstrating proactive engagement by confirming the site visit and next communication steps.",Execute the site ocular on Tuesday as promised; prepare a preliminary scope of work (SOW) based on the 120 sqm specs to present immediately after the inspection to maintain the client's momentum.
nancyvillanueva_80670375913241,Active Pipeline,"Nancy Villanueva is seeking a quotation for a 15-meter perimeter fence and a modern steel sliding gate in Bacoor, Cavite. Spectroplus provided a detailed quote of 145,000 PHP for a high-quality matte black powder-coated finish with concrete reinforcement. The conversation is currently active, with the company proactively following up to secure a fabrication schedule.","The client is highly intent-driven, providing complete project details and clear aesthetic preferences early on, indicating a readiness to commit if the price and quality meet expectations.","The company demonstrated excellent performance by responding quickly to the initial inquiry and providing a clear, itemized quote, followed by a professional follow-up within 48 hours.","Since the client has not yet confirmed, provide a sample portfolio of past 'matte black powder-coated' projects to build visual trust, and offer a site inspection visit to finalize technical measurements and move toward a signed contract."
patriciareyes_587165611251,Active Pipeline,"Patricia Reyes is actively collaborating with the design team on her residential project. She expressed high satisfaction with the initial master bedroom layout and exterior design, while requesting minor modifications to the steel window frames for a more seamless aesthetic. The company has acknowledged these requests and committed to providing updated renderings by the upcoming Thursday.","The client is highly engaged, provides clear and constructive feedback, and shows strong positive intent toward the design direction.","The company is performing well, demonstrating quick response times, active listening, and a clear project management timeline.",Ensure the updated 3D renderings are delivered on or before Thursday afternoon as promised to maintain momentum and build further trust with the client.
renatodizon_976813978691761,Unanswered Inbound,"The client reached out to inquire about a quote for a 2-storey modern single-detached residential build in Avida Settings, Bacoor, Cavite. They provided complete project details, including lot location and contact information, and followed up 24 hours later requesting an ocular inspection. The company has failed to respond to both the initial inquiry and the follow-up message.","The user is a high-intent, prepared lead who has provided all necessary documentation and is actively seeking a consultation and site visit.","The company has failed to perform, as they have not acknowledged a high-quality lead, potentially resulting in the loss of a significant construction contract.","Prioritize an immediate response acknowledging the message, apologizing for the delay, and confirming availability for the requested ocular inspection within the next 48 hours."
